song_id,title,artist,mood,tags,lyrics
1,Tum Hi Ho,Arijit Singh,romantic sad,"movie Aashiqui2 slow love","hum tere bin ab reh nahi sakte..."
2,Channa Mereya,Arijit Singh,heartbreak emotional,"wedding breakup remix","achha chalta hoon duaon mein yaad rakhna..."
3,Bekhayali,Sachet Tandon,heartbreak intense,"angry breakup guitar","bekhayali mein bhi tera hi khayal aaye..."
4,Apna Bana Le,Arijit Singh,romantic happy,"lofi love chill","apna bana le piya apna bana le..."
5,Kabira,Arijit Singh,emotional happy,"friendship wedding feelgood","kaise bataayein kyun tujhko chaahein..."
